{
  "rank": 2,
  "headline": "Bullet list with optional notes",
  "summary": "Shows bullet_list items using text plus optional note fields.",
  "sections": [
    {
      "id": "risks",
      "type": "bullet_list",
      "title": "Risks",
      "description": "Optional section description explains layout intent.",
      "items": [
        {
          "text": "Dependency on a single vendor",
          "note": "Mitigation: dual-source by Q3."
        },
        {
          "text": "Schedule slip on integration testing",
          "note": "Watch the critical path between sprints 4 and 5."
        },
        { "text": "No note on this line — notes are optional per item." }
      ]
    }
  ]
}
