{
    "rank": 1,
    "headline": "OpenAI Shuts Down Sora",
    "date_confirmed": "2026-03-24",
    "sources_confirmed": ["CNN", "TechCrunch", "Bloomberg"],
    "sections": [
      {
        "id": "what-happened",
        "type": "bullet_list",
        "title": "What Happened",
        "items": [
          { "text": "OpenAI shut down the Sora standalone app and API." },
          { "text": "The shutdown canceled a major Disney licensing deal." }
        ]
      },
      {
        "id": "why-it-matters",
        "type": "bullet_list",
        "title": "Why It Matters",
        "items": [
          { "text": "It suggests AI video generation may not yet have strong consumer demand." }
        ]
      }
    ]
  }